[
  {
    "utterance_id": "utt_20260729_b4e5f588_0079",
    "speaker_name": "김남준",
    "speaker_role": "위원",
    "spoken_at": "2026-07-29",
    "venue": {
      "type": "assembly_committee",
      "session": "제22대국회 제437회 (임시회) 제3차 재정경제기획위원회(2026.07.29.)"
    },
    "source": {
      "kind": "assembly_minutes",
      "url": "https://record.assembly.go.kr/assembly/viewer/minutes/xml.do?id=57026&type=view",
      "title": "제22대국회 제437회 (임시회) 제3차 재정경제기획위원회(2026.07.29.)"
    },
    "text": "최대한 5분 맞춰 보도록 하겠습니다.\n인천 계양을 출신 김남준입니다.\n구윤철 부총리님 그리고 박홍근 장관님께, 한번 말씀을 나눠 보면 좋겠습니다.\n대통령께서 샌프란시스코 AI 선언 발표를 하셨습니다. 아마 다 보셨을 것 같은데 저는 이렇게 평가합니다. AI 혁신의 표준을 한국이 주도하겠다라는 점을 명확하게 했고 글로벌 이니셔티브를 쥐고 가겠다 또 이를 확보해냈다 이렇게 평가를 해 볼 수 있다고 생각이 됩니다. 이때 서밋을 개최하면서 우리나라 반도체기업들이 굴지의 AI 글로벌 빅테크 기업들과도 함께 성과를 이뤄 냈습니다. 9500억 달러의 반도체 공급 협력을 체결하기도 했고요. 또 AI데이터센터 또 GPU 200만 장 이런 대규모 투자 협력을 맺기도 했습니다. 또 피지컬 AI와 같은 서비스, 인재 양성 관련해서 전략적 파트너십도 구축했다 이런 소식들이 들려 왔습니다.\n그야말로 AI 3강으로 대한민국이 진출하기 위해서 그런 교두보들을 치밀하게 마련을 해 나가고 있다, 그렇게 노력을 하고 있다라고 보여지는데요. AI 대전환의 시대에 대한민국이라는 국가 브랜드가 세계 글로벌시장에서 어떻게 포지셔닝되어야 하느냐 이런 것들에 대한 컨센서스가 있어야 앞으로 거기에 따른 우리의 대응전략이라고 할까요, 이런 것들이 마련될 수 있고 국회도 그런 차원에서 같이 공감대를 이루면서 한 방향을 보고 나아갈 수 있을 거라고 생각이 되는데 그런 차원에서 두 분께서 짧게, 대한민국이라는 국가 브랜드를 이 AI 국제시장에서 어떻게 포지셔닝하는 게 바람직하다고 보시는지 한번 의견을 듣고 싶습니다.",
    "order": 79
  },
  {
    "utterance_id": "utt_20260706_375817bd_0019",
    "speaker_name": "김선민",
    "speaker_role": "위원",
    "spoken_at": "2026-07-06",
    "venue": {
      "type": "assembly_committee",
      "session": "제22대국회 제437회 (임시회) 제1차 과학기술정보방송통신위원회(2026.07.06.)"
    },
    "source": {
      "kind": "assembly_minutes",
      "url": "https://record.assembly.go.kr/assembly/viewer/minutes/xml.do?id=56951&type=view",
      "title": "제22대국회 제437회 (임시회) 제1차 과학기술정보방송통신위원회(2026.07.06.)"
    },
    "text": "존경하는 송기헌 위원장님 그리고 한준호 곧 간사님께 깊은 감사말씀 드립니다.\n저는 지난 전반기에 보건복지위원회에서 일했습니다. 저는 원래 의사인데 건강보험·보건의료 정책 분야에서 오래 일했습니다. 제 경력을 말씀드린다면 과학기술 그리고 정보통신이 의료를 포함한 여러 사회보장 분야에서 얼마나 중요한지를 일의 현장에서 몸소 뼈저리게 느낀 사람입니다.\n한국의 건강보험 특성을 말씀드리자면 단기간 고속 성장을 이룩하면서 많은 문제를 노정했지만 이 문제를 정보통신기술로 해결하고 극복해 온 나라라고 표현할 수 있겠습니다. 이 이야기는 저의 개인적인 생각이 아니라 여러 국제기구에서도 그렇게 이미 평가를 한 적이 있고 국민들께서는 코로나 팬데믹 시기에 그 현황을 뼈저리게 느끼셨을 겁니다.\n지금은 AI 대전환의 시기로서 새로운 전기점을 마련하느냐 아니면 거기에 치어 가느냐 하는 둘 중의 기로에 선 시기일 것 같습니다. 소버린 AI나 AI 거버넌스 그리고 개인정보의 문제는 그냥 먼 이야기 혹은 학문적인 이야기가 아니라 사회보장의 현장에서는 이미 매우 중요한 현장의 문제로 다가왔습니다.\n또 방송통신의 대전환도 의료소비자, 복지소비자의 문화 대전환을 이루고 있습니다. 이 과정에서 제 개인적인 경험을 살려서 과학기술정보방송통신위원회에서 활동을 이어 가겠습니다.\n동료·선배 위원님들의 많은 도움 부탁을 드리겠습니다.\n알권리, 정보주권 그리고 디지털 사회권, 정보접근권 그리고 방송 민주주의를 위해서 열심히 노력하겠습니다.\n감사합니다.",
    "order": 19
  },
  {
    "utterance_id": "utt_20260428_aff0a6e6_0156",
    "speaker_name": "이해민",
    "speaker_role": "위원",
    "spoken_at": "2026-04-28",
    "venue": {
      "type": "assembly_committee",
      "session": "제22대국회 제434회 (임시회) 제5차 과학기술정보방송통신위원회(2026.04.28.)"
    },
    "source": {
      "kind": "assembly_minutes",
      "url": "https://record.assembly.go.kr/assembly/viewer/minutes/xml.do?id=56569&type=view",
      "title": "제22대국회 제434회 (임시회) 제5차 과학기술정보방송통신위원회(2026.04.28.)"
    },
    "text": "영국에서 받았지요. 52개 기업은 다 미국 기업인데 영국 같은 경우는 AI안보연구소(AISI)에서 받아서 독립 평가까지 지금 하고 있는 상황이지요.\n그래서 부총리께서도 이렇게 말씀을 하셨습니다, 대한민국은 스탠퍼드 AI Index 2026년 기준 주목할 만한 AI 모델 수에서 세계 3위권으로 평가받고 있으며 최근 국내 모델 수가 8개로 보정될 예정이라는 발표도 있었습니다.\n지금 우리가 AI 글로벌 3강 이 불이 막 지펴지고 있는데 그리고 방금 부총리께서 쓰신 말만 보면 미국·중국 다음으로 우리인데 그런데 왜 우리가 아니라 영국이었을까 저는 궁금하고, 전 세계에서 처음으로 AI 기본법도 시행 중이고 그 안에서 거버넌스를 정의한 것에 따라서 AI전략위원회도 훌륭하게 굴러가고 있고 그다음에 AI안전연구소도 기본법에서 정의를 내리고 있어요. 그 AI안전연구소 운영 중에 있는데 왜 우리가 아니라 영국이 받았을까, 좀 아쉬운 점이 있다라는 것을 말씀을 드리고.\n물론 알아봤더니 차관님 비롯해서 AI안전연구소 그다음에 정부기관 그리고 무엇보다 가장 두려움에 떨고 있을 우리나라의 기업들이 먼저 나서서 지금 이 파트너십을 위해서 뛰고 있다고 보고를 들었습니다.\n노력하고 계신 것은 감사하지만 저는 지금 시간이 별로 없다라는 생각을 하고 있어요. 시간이 왜 없는지 그것 조금 얘기를 드릴게요.\n지금 우리에게 주어진 두 가지 데드라인이 있다고 생각을 합니다. 첫 번째는 7월 초인데, 왜 7월 초냐? 이번에 글래스윙 프로젝트를 통해서 미토스가 찾아낸 취약점, 그 정책에 따라서 90일 후 전면 공개가 된다라고 되어 있어서 그때가 굉장히 신경써야 되는 시점이고.\n또 하나는 올해 연말인데요, 부총리께서 ‘저희도 공개 가능한 범위 안에서 이제는 역량 점검을 해 보았습니다’ 하셨고 ‘우리에게 독자 파운데이션 모델이 있으니 다행이다’라고 하셨는데 거기서 끝나면 안 되는 이유가 그것인데.\n많은 전문가들이 앤트로픽뿐만 아니라 미토스 비슷한 수준의 AI 보안 능력을 갖추는 모델이 짧으면 두 달 안에 나오기 시작할 것이고 길어 봤자 연말을 예측하면서 우려를 하고 있어요. 이것은 우리가 언젠가, 새해 연휴 때 딥시크 충격이 있었던 것을 이제는 해킹 영역에서 느낄 수 있다고 보는데 그래서 이 시간 때문에 저는 7월과 12월 그 두 가지 시간을 두고 우리나라 상황을 좀 살펴봤습니다. 아마 여기서 의원실 질의를 받으신 부서 많으실 텐데, 과기부하고 KISA에 관련된 전략을 물어봤는데, 하나씩 좀 보겠습니다.\n(영상자료를 보며)\nK-보안 LLM이 해킹 위협을 예측하고 AI가 공격을 차단하는 AI사이버 실드 돔 기술 개발은 2027년 착수 목표, 5개년 사업이고요.\n해킹 예방 단계에서 AI를 통한 자동화 대응을 실현하겠다는 AI 사이버 예방체계 구축, KISA에서는 2027년 신규 사업 목표.\n그리고 제가 작년 국감에서 법적 근거는 10년 전에 만들어졌는데 왜 아직도 운영 안 하냐라고 그때 질의했었던 보안인재 관리체계는 올해도 예산 확보를 못 해서 임시 운영 중.\n그리고 차세대 AI 보안 서비스 개발 지원은 아직 계획이 없음.\nKISA에서는 독파모 이후에 K-미토스를 만들겠다라는 사업이라고 하네요. 저는 이 K자 그만 붙였으면 좋겠는데.\nLLM의 취약점 알아보기 위해서 그리고 과기부가 3명에서 4명 규모로 만들었다는 AI 레드팀 이것은 아직 업무 범위가 정해지지 않아서 팀 운영 설계 단계.\n미토스처럼 전 세계 AI 보안 위협이 지금 현실화가 되고 있는데 우리 정부 사업은 지금까지 해 오던 관성이 사실 그러하기 때문에 저도 이것을 가지고 마냥 뭐라고 하기에는 좀 어렵기는 합니다, 일하는 체질을 바로 바꿔 버릴 수는 없으니까.\n그런데 지금 보셨듯이 대부분 기획 중, 설계 중, 인내를 가지고 기다려 달라는 말을 계속 들었어요. 늘 말씀드리지만 기술 속도를 법하고 제도가 따라가기 힘듭니다. 하지만 미토스를 통해서 우리가 뭔가 배우는 게, 교훈이 좀 있었으면 좋겠어요.\n이게 보안 관련 중장기 기술 개발 완료되면 무용지물이 될 수 있다라는 부분입니다. 그래서 우리나라가 이제 한 발짝씩 늦는 꼴이 될까 봐, 그래서 저는 어떤 정책을 앞으로 세우시더라도 기술 관련된 것은 진짜 수요자 중심으로 해결을 하셔야 된다. 정책을 공급하는 입장에서는, 이렇게 이렇게 좋은 정책을 만들고 있어요는 그냥 공급자 입장입니다. 실제로 이 보안 위협을 느끼는 기업이나 아니면 국민들은 그것을 기다려 줄 수가 없어요.\n그렇기 때문에 그들의 입장에서 시간 타임라인도 정하고 시작하는 게 좋지 않을까 해서, 지금 말씀드린 사업들 다 좋은데 그렇다면 지금 현실적으로 우리나라가 가지고 있는 것보다 훨씬 더 높은 수준의 기술이 나왔을 때, 해킹기술이 나왔을 때 어떻게 우리가 대응할까, 그런 정책으로 차근차근 바꿔 가야 된다 말씀을 드리고 싶고요.\n그리고 또 하나, 아까 전문가들이 얘기했듯이 지금 엔트로픽만 내놓을 게 아니거든요. 그러니까 글래스윙 프로젝트를 딱 가동하는 걸 보면서 좀 불안한 게 앤트로픽 블록 따로, 구글 블록 따로 아니면 오픈AI 블록 따로 아니면 바라건대 엑사원 블록 따로 이런 식으로 전 세계가 기술을 중심으로 블록화가 되려나라는 걱정 또한 있습니다. 그렇게 됐을 때 한국은 하나만 바라보게 되면, 늘 독점은 위험하지요. 그래서 하나만 바라보게 되면 그 종속력이 너무 세지기 때문에 빨리 움직이셔서, 지금 아마 오픈AI 쪽 사이버도 접촉 중이신 걸로 아는데 각 블록에 대해서는 무조건 다중화 전략을 가져 가시기를 좀 당부를 드리고요. 이거는 차관님 이하 과기정통부에서도 다 챙기셔야 된다는 점 이야기를 드립니다.\n그리고 시간이……\n방미통위 위원장님께 이따가 추가질의드리겠습니다.",
    "order": 156
  },
  {
    "utterance_id": "utt_20260406_20a0342d_0014",
    "speaker_name": "노용석",
    "speaker_role": "중소벤처기업부제1차관",
    "spoken_at": "2026-04-06",
    "venue": {
      "type": "assembly_committee",
      "session": "제22대국회 제434회 (임시회) 제1차 산업통상자원중소벤처기업위원회(2026.04.06.)"
    },
    "source": {
      "kind": "assembly_minutes",
      "url": "https://record.assembly.go.kr/assembly/viewer/minutes/xml.do?id=56502&type=view",
      "title": "제22대국회 제434회 (임시회) 제1차 산업통상자원중소벤처기업위원회(2026.04.06.)"
    },
    "text": "존경하는 이철규 산업통상자원중소벤처기업위원회 위원장님 그리고 위원님 여러분!\n오늘 위원장님과 여러 위원님들을 모시고 중소벤처기업부 소관 2026년도 제1회 추가경정예산안 및 기금운용계획변경안에 대해 보고드리게 된 것을 매우 뜻깊게 생각합니다.\n최근 우리 경제는 중동 전쟁 장기화로 인해 고유가와 고환율이 지속되고 운송 차질, 물류비 상승 등이 이어져 경제성장의 중요한 축인 수출에 악영향이 발생하고 있습니다. 또한 중소기업과 소상공인의 경영 부담이 가중되는 등 민생경제에 미치는 영향도 점차 커지고 있습니다.\n이에 따라 중소벤처기업부는 소상공인과 중소기업이 중동 전쟁으로 촉발된 대내외 위기를 극복하고 경영 안정을 도모할 수 있도록 28개 사업에 총 1조 9374억 원 규모의 추경예산안을 편성하여 국회에 제출하였습니다.\n금번 추경안은 첫째 수출 중소기업의 중동 전쟁 피해 최소화, 둘째 소상공인 경영 안정, 셋째 청년 일자리 지원을 위한 창업 촉진, 넷째 지역 중소 제조기업 AI 전환 등 4대 분야를 집중적으로 지원하기 위해 편성되었습니다.\n추경안의 주요 내용은 다음과 같습니다.\n첫째, 중동 전쟁으로 인해 어려워진 수출 중소기업의 피해를 최소화하고 시장 다변화를 통한 중장기 경쟁력 강화를 지원하기 위해 4622억 원을 증액 반영했습니다.\n운송 차질과 물류비 상승 등 수출 현장의 단기 위기에 신속 대응하기 위해 수출바우처를 1000억 원 증액하였으며 고환율 및 원자재 가격 급등 등으로 일시적 경영 애로를 겪는 기업을 위해 긴급경영안정자금을 2500억 원 추가 공급하고자 합니다. 아울러 중동 전쟁 피해 기업이 수출국을 다변화할 수 있도록 수출 규제 부담 완화와 온라인 수출 지원에 122억 원을 증액하고 대체 시장 확보 등에 필요한 신시장진출지원자금의 공급 규모를 1000억 원 확대할 계획입니다.\n둘째, 민생회복을 위한 소상공인 등의 경영 안정 지원에 5852억 원을 증액 반영했습니다.\n자금 여력이 부족한 소상공인의 유동성 확보를 위해 특별경영안정자금을 3200억 원 확대하고 보증 공급을 강화하기 위해 기술보증기금과 신용보증기금에 각각 1000억 원 추가 출연할 계획입니다. 또한 경영 한계에 직면한 소상공인의 위험을 선제적으로 포착하여 원활한 폐업과 재도전을 지원하는 희망리턴패키지 예산을 246억 원 증액하였습니다.\n세 번째로는 중동 전쟁으로 위축될 우려가 있는 경제 상황에서 청년이 창업을 통해 일자리를 확보할 수 있도록 스타트업 열풍을 조성하기 위해 8031억 원을 증액 편성하였습니다.\n혁신 창업가를 발굴하여 단계별 경연을 통해 창업 멘토링을 제공하고 아이디어에서 사업화까지 원스톱으로 지원할 수 있도록 창업 인재 육성 플랫폼인 모두의 창업 프로젝트에 1550억 원을 신규 편성하고 딥테크 중심의 지역거점 창업 도시를 조성하기 위해 창업중심대학 예산을 240억 원 증액하였습니다. 로컬 창업을 활성화하여 지역 상권의 자생력을 높이는 모두의 지역 상권 조성을 추진하기 위해 기업가형 소상공인 지원 예산을 603억 원 증액하였습니다.\n방산, AI 등 핵심 전략 분야에서 국내 대기업과 스타트업 간의 개방형 혁신을 촉진하는 민관협력 오픈이노베이션 사업을 784억 원 증액하고 초기 창업기업, 재도전기업, 지역 소재기업에 중점 투자하는 벤처펀드 조성을 위해 모태펀드 출자금 규모를 1700억 증액하였습니다.\n마지막으로 지역 일자리의 원천인 지역 중소 제조기업이 인공지능 전환을 통해 경쟁력을 강화할 수 있도록 상생형 스마트공장 구축과 제조AI 전문인력 확보에 870억 원을 증액하였습니다.\n존경하는 이철규 위원장님과 위원님 여러분!\n이상 보고드린 2026년 제1회 추가경정예산안 및 기금운용계획변경안이 중동 전쟁으로 어려움을 겪고 있는 소상공인과 중소기업의 위기 극복에 도움이 될 수 있도록 위원님들께서 신속하게 심의 의결하여 주실 것을 부탁드립니다.\n중소벤처기업부는 추경예산안이 확정되는 대로 즉시 집행에 착수할 수 있도록 모든 정책 역량을 집중하겠습니다.\n감사합니다.",
    "order": 14
  },
  {
    "utterance_id": "utt_20260729_b4e5f588_0273",
    "speaker_name": "구윤철",
    "speaker_role": "부총리겸재정경제부장관",
    "spoken_at": "2026-07-29",
    "venue": {
      "type": "assembly_committee",
      "session": "제22대국회 제437회 (임시회) 제3차 재정경제기획위원회(2026.07.29.)"
    },
    "source": {
      "kind": "assembly_minutes",
      "url": "https://record.assembly.go.kr/assembly/viewer/minutes/xml.do?id=57026&type=view",
      "title": "제22대국회 제437회 (임시회) 제3차 재정경제기획위원회(2026.07.29.)"
    },
    "text": "위원님, 좋은 질문 감사합니다.\n지금 양극화는 아주 광범하게 퍼져 있습니다. 산업으로 보면 잘나가는 산업 못 나가는 산업 그다음에 전체로 보면 대기업, 중소기업 이렇게 되고요. 또 지역으로 보면 수도권, 비수도권 이게 양극화가 굉장히 심합니다. 거기에다가 저소득층, 부자 또 돈 어려운…… 이런 부분인데, 그래서 저희들은 기존 산업 같은 경우도 예를 들어 철강이나 석유화학 같은 경우인데 여기다가 구조조정을 좀 하고 나면 어쨌거나 경쟁력을 붙일까 해서 그 공정을 AI로 한다든지 수소환원제철을 한다든지, 석유화학 같은 경우도 좀 더 고급의 석유화학 제품을 만든다든지 이런 데 R&D를 지원해 준다든지 철강 같으면 특수탄소강을 만드는 이런 식으로 고부가가치로 나가겠다는 말씀을 드리고요.\n또 어려운 게 지역입니다. 지역은 좀 이따 말씀해 주실 거니까 됐고요.\n그다음에 또 어려운 게 소상공인·자영업자·중소기업들입니다. 그래서 저희들도 첫째는 그나마 세수가 많이 들어오니까 이걸로 일단 당장은 이분들이 어려움을 좀 극복할 수 있게 지원을 해 주더라도 중장기적으로는 경쟁력 제고를 해야 된다. 그래서 AI를 중소기업의 어떤 공정에 적용한다든지 AI를 활용해서 공정 관리를 하고 제품을 관리하고 하여튼 뭔가 할 수 있는, 그래서 저희들이 생활형 R&D라는 개념으로 해서 소상공인·자영업자도 해 주고 중소기업 지원도 해 주고 하는 그런 역량 강화에 중점을 두겠다는 말씀을 드리고요.\n저소득층 같은 경우는 어차피 근로 의욕이 없다면 정부가 복지로 해결하되 일할 분들에 대해서는 다양한 형태의 어떤 신기술을 최대한 교육을 시키고 이래서 청년들 AI 교육 20만 명을 시키겠다 또 반도체·AI 인력 양성 10만 명을 하겠다 이렇게 나가는 부분이니까, 저희들이 하여튼 잘나가는 부분은 더 잘나갈 수 있게 해 주고 또 거기에서 나오는 재원을 K자 양극화에 있는 어려운 분들에 단기적으로는 보조를 해 주더라도 중장기적으로는 역량 개발을 해 줘서 진짜 제대로 역량을 개발해서 살아 나갈 수 있는 여러 가지 복합적인 정책을 쓰고 있다는 말씀을 드리겠습니다.",
    "order": 273
  },
  {
    "utterance_id": "utt_20260729_9beb8c79_0014",